{
  "schema_id": "https://schemas.reiyah.invalid/gate-a/1.1.0/standards-crosswalk.schema.json",
  "schema_version": "1.1.0",
  "artifact_id": "reiyah.artifact.standards-crosswalk-1.1.0",
  "crosswalk_id": "reiyah.standards-crosswalk.gate-a",
  "version": "1.1.0",
  "as_of_date": "2026-08-23",
  "lifecycle_status": "proposed",
  "runtime_execution_authorized": false,
  "compliance_claimed": false,
  "predecessor": {
    "artifact_id": "reiyah.artifact.standards-crosswalk-1.0.0",
    "version": "1.0.0",
    "path": "evidence/standards-crosswalk.json",
    "sha256": "sha256:1d1cf810b1cc5dfaf812e54c99925666f924e532d7550083f846119b3ed3d0e6",
    "byte_size": 21223
  },
  "source_ledger_ref": {
    "artifact_id": "reiyah.artifact.source-ledger-1.1.0",
    "version": "1.1.0",
    "path": "evidence/source-ledger-1.1.0.json",
    "sha256": "sha256:61ea0ba90cba3bd68dba3283560c16b699f1e5d954062e1d53a18846c10d774c",
    "byte_size": 32634
  },
  "entries": [
    {
      "mapping_id": "map.iso.26262-1.2018.scope-boundary",
      "lifecycle_status": "proposed",
      "mapping_state": "partial_mapping",
      "external_reference": {
        "publisher": {
          "state": "observed",
          "value": "International Organization for Standardization (ISO)"
        },
        "title": {
          "state": "observed",
          "value": "ISO 26262-1:2018 Road vehicles — Functional safety — Part 1: Vocabulary"
        },
        "document_identifier": {
          "state": "observed",
          "value": "ISO 26262-1:2018"
        },
        "exact_version": {
          "state": "observed",
          "value": "ISO 26262-1:2018, edition 2"
        },
        "publication_date": {
          "state": "observed",
          "value": "2018-12-17"
        }
      },
      "identity_source_ref": {
        "source_id": "src.iso.26262-1.2018.open-data",
        "version": "1.1.0"
      },
      "scope": {
        "state": "observed",
        "value": "Publisher catalog metadata scopes Part 1 to vocabulary for a functional-safety framework addressing hazards caused by malfunctioning behaviour of safety-related road-vehicle E/E systems and identifies exclusions."
      },
      "comparator": {
        "state": "observed",
        "value": "ISO 21448:2022 catalog scope for intended-function insufficiency, plus proposed Reiyah protocol reiyah.protocol.harbor-gate-a@1.1.0 as an architecture-only target with no conformance baseline."
      },
      "requirement_locator": {
        "state": "observed",
        "value": "ISO Open Data record 68383 fields reference, publicationDate, edition, currentStage, replacedBy, and scope; no normative clause locator is retained."
      },
      "evidence_source_refs": [
        {
          "source_id": "src.iso.26262-1.2018.open-data",
          "version": "1.1.0"
        }
      ],
      "discovery_source_refs": [],
      "proposed_relevance": "The metadata suggests a useful architecture boundary between evidence about malfunctioning behaviour and evidence about intended-function or model insufficiency. Reiyah proposes to preserve that distinction; it does not implement an ISO 26262 lifecycle or claim alignment.",
      "gap": {
        "state": "open",
        "description": "Only a publisher catalog record for Part 1 is retained, while the ISO 26262 series text, relevant clauses, interpretations, later parts, and in-development successor are absent.",
        "closure_requirements": [
          "Lawfully obtain and retain the exact normative editions and parts selected for a future mapping, including licence and access constraints.",
          "Have a qualified independent reviewer identify exact clauses, applicability, exclusions, and the relationship to the then-current ISO revision.",
          "Define a separately authorized protocol-level comparator before evaluating any alignment or conformance question."
        ]
      },
      "prohibited_interpretation": "This mapping is not a legal, safety, conformance, certification, compliance, scientific-support, benchmark-superiority, or operator-acceptance conclusion."
    },
    {
      "mapping_id": "map.iso.21448.2022.scope-boundary",
      "lifecycle_status": "proposed",
      "mapping_state": "partial_mapping",
      "external_reference": {
        "publisher": {
          "state": "observed",
          "value": "International Organization for Standardization (ISO)"
        },
        "title": {
          "state": "observed",
          "value": "ISO 21448:2022 Road vehicles — Safety of the intended functionality"
        },
        "document_identifier": {
          "state": "observed",
          "value": "ISO 21448:2022"
        },
        "exact_version": {
          "state": "observed",
          "value": "ISO 21448:2022, edition 1"
        },
        "publication_date": {
          "state": "observed",
          "value": "2022-06-30"
        }
      },
      "identity_source_ref": {
        "source_id": "src.iso.21448.2022.open-data",
        "version": "1.1.0"
      },
      "scope": {
        "state": "observed",
        "value": "Publisher catalog metadata describes an argument framework and guidance for hazards from intended-function specification or performance insufficiencies, including situational awareness derived from complex sensors and processing, foreseeable misuse, and declared exclusions."
      },
      "comparator": {
        "state": "observed",
        "value": "ISO 26262-1:2018 publisher scope for malfunctioning E/E behaviour, plus proposed Reiyah protocol reiyah.protocol.harbor-gate-a@1.1.0 with no implementation or conformance target."
      },
      "requirement_locator": {
        "state": "observed",
        "value": "ISO Open Data record 77490 fields reference, publicationDate, edition, currentStage, replacedBy, and scope; no normative clause locator is retained."
      },
      "evidence_source_refs": [
        {
          "source_id": "src.iso.21448.2022.open-data",
          "version": "1.1.0"
        }
      ],
      "discovery_source_refs": [],
      "proposed_relevance": "The retained scope summary suggests that unknown scenarios, functional insufficiencies, situational-awareness limits, and foreseeable misuse are relevant boundary categories for an evidence engine. Reiyah proposes only to keep those categories distinguishable from faults and outcomes.",
      "gap": {
        "state": "open",
        "description": "The full 181-page standard, its clauses, evidence expectations, and pending successor are not retained, so no requirements-level mapping is possible.",
        "closure_requirements": [
          "Lawfully obtain and retain the exact ISO 21448 edition selected for review and its applicable successor status.",
          "Commission an independent clause-level review that distinguishes SOTIF terminology from Reiyah's proposed constructs and validity states.",
          "Define falsifiable protocol comparisons without converting a scope similarity into a safety or compliance claim."
        ]
      },
      "prohibited_interpretation": "This mapping is not a legal, safety, conformance, certification, compliance, scientific-support, benchmark-superiority, or operator-acceptance conclusion."
    },
    {
      "mapping_id": "map.iso-pas.8800.2024.ai-safety-scope",
      "lifecycle_status": "proposed",
      "mapping_state": "partial_mapping",
      "external_reference": {
        "publisher": {
          "state": "observed",
          "value": "International Organization for Standardization (ISO)"
        },
        "title": {
          "state": "observed",
          "value": "ISO/PAS 8800:2024 Road vehicles — Safety and artificial intelligence"
        },
        "document_identifier": {
          "state": "observed",
          "value": "ISO/PAS 8800:2024"
        },
        "exact_version": {
          "state": "observed",
          "value": "ISO/PAS 8800:2024, edition 1"
        },
        "publication_date": {
          "state": "observed",
          "value": "2024-12-13"
        }
      },
      "identity_source_ref": {
        "source_id": "src.iso-pas.8800.2024.open-data",
        "version": "1.1.0"
      },
      "scope": {
        "state": "observed",
        "value": "Publisher catalog metadata scopes the PAS to safety-related road-vehicle systems using AI and describes output insufficiencies, systematic errors, random hardware errors, external AI interactions, and safety-related properties for assurance arguments."
      },
      "comparator": {
        "state": "observed",
        "value": "ISO 21448:2022 publisher scope for intended-function insufficiency, compared only at metadata level with proposed Reiyah protocol reiyah.protocol.harbor-gate-a@1.1.0."
      },
      "requirement_locator": {
        "state": "observed",
        "value": "ISO Open Data record 83303 fields reference, publicationDate, edition, currentStage, replacedBy, and scope; no PAS clause locator is retained."
      },
      "evidence_source_refs": [
        {
          "source_id": "src.iso-pas.8800.2024.open-data",
          "version": "1.1.0"
        }
      ],
      "discovery_source_refs": [],
      "proposed_relevance": "The metadata suggests future evidence categories for AI output insufficiency, systematic error, hardware error, and external-element interaction. Gate A proposes provenance and explicit-invalidity structures that may later be compared with those categories; it authorizes no AI runtime or safety assurance claim.",
      "gap": {
        "state": "open",
        "description": "The 172-page PAS and its safety-related properties are not retained, and the catalog record lists two unretained replacement projects.",
        "closure_requirements": [
          "Lawfully retain the exact PAS text and metadata for any successor selected at the time of future review.",